<?xml version="1.0" encoding="UTF-8"?>
<router-configurations xmlns="http://www.expd.com/xsd/jms/cdb"
	xmlns:xsi="http://www.w3.org/2001/XMLSchema-instance"
	xsi:schemaLocation="http://www.expd.com/xsd/jms/cdb router-configuration.xsd">
	<environment domain="QA">
		<jms-provider>
			<messagingProviderHostName>mgqai-chq.chq.ei</messagingProviderHostName>
			<messagingProviderPortNumber>28600</messagingProviderPortNumber>
			<userName>app_cdb_router</userName>
			<password>app_cdb_router</password>
			<brokerNode>qai_CHQ1_node</brokerNode>
		</jms-provider>
		<backup-jms-provider>
			<messagingProviderHostName>mgqai-chq-bu.chq.ei</messagingProviderHostName>
			<messagingProviderPortNumber>28600</messagingProviderPortNumber>
		</backup-jms-provider>
		<email-contact>vizdf.errors@expeditors.com</email-contact>
		<email-contact>test.administrator@expeditors.com</email-contact>
	</environment>
</router-configurations>
